{
  "schema_version": "1.0.0",
  "passport_id": "bp_consultco_v1",
  "organization_id": "org_consultco",
  "version": 1,
  "company_profile": {
    "display_name": "ConsultCo",
    "employee_count": 10,
    "region": "US",
    "business_model": "client_services",
    "team_type": "consulting"
  },
  "facts": [
    {
      "fact_id": "bf_no_customer_training",
      "organization_id": "org_consultco",
      "subject_type": "policy",
      "subject_id": "policy_ai_data_use",
      "field": "product.trains_on_customer_data",
      "operator": "eq",
      "value": false,
      "kind": "hard_constraint",
      "stakeholder_role": "security_privacy_owner",
      "source": { "provider": "fixture", "adapter_mode": "DEVELOPMENT_FIXTURE", "content_id": "cnt_privacy_policy", "version_id": "ver_privacy_policy_v1", "chunk_index": 3, "retrieved_at": "2026-08-02T00:00:00Z" },
      "verification": { "status": "human_approved", "method": "policy_owner_confirmation", "verified_by": "usr_security_owner", "verified_at": "2026-08-02T00:05:00Z" },
      "valid_from": "2026-08-01T00:00:00Z",
      "valid_until": null,
      "sensitivity": "restricted",
      "confidence": "confirmed"
    },
    {
      "fact_id": "bf_residency_us",
      "organization_id": "org_consultco",
      "subject_type": "policy",
      "subject_id": "policy_data_residency",
      "field": "product.data_residency",
      "operator": "in",
      "value": ["US"],
      "kind": "hard_constraint",
      "stakeholder_role": "security_privacy_owner",
      "source": { "provider": "fixture", "adapter_mode": "DEVELOPMENT_FIXTURE", "content_id": "cnt_privacy_policy", "version_id": "ver_privacy_policy_v1", "chunk_index": 5, "retrieved_at": "2026-08-02T00:00:00Z" },
      "verification": { "status": "human_approved", "method": "policy_owner_confirmation", "verified_by": "usr_security_owner", "verified_at": "2026-08-02T00:05:00Z" },
      "valid_from": "2026-08-01T00:00:00Z",
      "valid_until": null,
      "sensitivity": "confidential",
      "confidence": "confirmed"
    },
    {
      "fact_id": "bf_restricted_client_conversations",
      "organization_id": "org_consultco",
      "subject_type": "workflow",
      "subject_id": "workflow_client_meetings",
      "field": "buyer.client_conversations_restricted",
      "operator": "eq",
      "value": true,
      "kind": "hard_constraint",
      "stakeholder_role": "security_privacy_owner",
      "source": { "provider": "admin_input", "adapter_mode": "MANUAL_INPUT", "content_id": "cnt_request_interview", "version_id": "ver_request_interview_v1", "chunk_index": 0, "retrieved_at": "2026-08-02T00:10:00Z" },
      "verification": { "status": "human_approved", "method": "workflow_owner_confirmation", "verified_by": "usr_operations_owner", "verified_at": "2026-08-02T00:12:00Z" },
      "valid_from": "2026-08-02T00:00:00Z",
      "valid_until": null,
      "sensitivity": "restricted",
      "confidence": "confirmed"
    },
    {
      "fact_id": "bf_source_linked_answers",
      "organization_id": "org_consultco",
      "subject_type": "workflow",
      "subject_id": "workflow_decision_retrieval",
      "field": "product.source_linked_answers",
      "operator": "eq",
      "value": true,
      "kind": "hard_constraint",
      "stakeholder_role": "operations_owner",
      "source": { "provider": "admin_input", "adapter_mode": "MANUAL_INPUT", "content_id": "cnt_request_interview", "version_id": "ver_request_interview_v1", "chunk_index": 1, "retrieved_at": "2026-08-02T00:10:00Z" },
      "verification": { "status": "human_approved", "method": "outcome_owner_confirmation", "verified_by": "usr_operations_owner", "verified_at": "2026-08-02T00:12:00Z" },
      "valid_from": "2026-08-02T00:00:00Z",
      "valid_until": null,
      "sensitivity": "internal",
      "confidence": "confirmed"
    },
    {
      "fact_id": "bf_guest_notice",
      "organization_id": "org_consultco",
      "subject_type": "policy",
      "subject_id": "policy_recording_notice",
      "field": "product.guest_recording_notice",
      "operator": "eq",
      "value": true,
      "kind": "hard_constraint",
      "stakeholder_role": "legal_owner",
      "source": { "provider": "fixture", "adapter_mode": "DEVELOPMENT_FIXTURE", "content_id": "cnt_recording_policy", "version_id": "ver_recording_policy_v1", "chunk_index": 2, "retrieved_at": "2026-08-02T00:00:00Z" },
      "verification": { "status": "approved_policy_source", "method": "legal_policy_review", "verified_by": "usr_legal_owner", "verified_at": "2026-08-02T00:06:00Z" },
      "valid_from": "2026-08-01T00:00:00Z",
      "valid_until": null,
      "sensitivity": "confidential",
      "confidence": "confirmed"
    },
    {
      "fact_id": "bf_stack_integrations",
      "organization_id": "org_consultco",
      "subject_type": "stack",
      "subject_id": "stack_current",
      "field": "product.native_integrations",
      "operator": "contains_all",
      "value": ["google_workspace", "slack", "zoom"],
      "kind": "preference",
      "stakeholder_role": "stack_owner",
      "source": { "provider": "stackfile", "adapter_mode": "CANONICAL_STACKFILE", "content_id": "cnt_stack_lock", "version_id": "ver_stack_lock_v1", "chunk_index": 0, "retrieved_at": "2026-08-02T00:00:00Z" },
      "verification": { "status": "platform_verified", "method": "stackfile_reconciliation", "verified_by": "svc_stackfile", "verified_at": "2026-08-02T00:00:00Z" },
      "valid_from": "2026-08-02T00:00:00Z",
      "valid_until": null,
      "sensitivity": "confidential",
      "confidence": "observed"
    },
    {
      "fact_id": "bf_low_admin_capacity",
      "organization_id": "org_consultco",
      "subject_type": "company",
      "subject_id": "team_operations",
      "field": "buyer.admin_capacity",
      "operator": "eq",
      "value": "low",
      "kind": "preference",
      "stakeholder_role": "operations_owner",
      "source": { "provider": "admin_input", "adapter_mode": "MANUAL_INPUT", "content_id": "cnt_request_interview", "version_id": "ver_request_interview_v1", "chunk_index": 2, "retrieved_at": "2026-08-02T00:10:00Z" },
      "verification": { "status": "human_approved", "method": "operations_owner_confirmation", "verified_by": "usr_operations_owner", "verified_at": "2026-08-02T00:12:00Z" },
      "valid_from": "2026-08-02T00:00:00Z",
      "valid_until": null,
      "sensitivity": "confidential",
      "confidence": "confirmed"
    },
    {
      "fact_id": "bf_budget_ceiling",
      "organization_id": "org_consultco",
      "subject_type": "budget",
      "subject_id": "budget_client_delivery",
      "field": "offer.landed_total",
      "operator": "lte",
      "value": "1000.00",
      "kind": "hard_constraint",
      "stakeholder_role": "budget_owner",
      "source": { "provider": "admin_input", "adapter_mode": "MANUAL_INPUT", "content_id": "cnt_budget_approval", "version_id": "ver_budget_approval_v1", "chunk_index": 0, "retrieved_at": "2026-08-02T00:08:00Z" },
      "verification": { "status": "human_approved", "method": "budget_owner_confirmation", "verified_by": "usr_budget_owner", "verified_at": "2026-08-02T00:09:00Z" },
      "valid_from": "2026-08-02T00:00:00Z",
      "valid_until": "2026-08-31T23:59:59Z",
      "sensitivity": "restricted",
      "confidence": "confirmed"
    }
  ],
  "stakeholders": [
    { "role": "requester", "actor_ref": "usr_requester", "authorities": ["submit_request"] },
    { "role": "operations_owner", "actor_ref": "usr_operations_owner", "authorities": ["set_outcome_weights", "approve_stack_patch"] },
    { "role": "security_privacy_owner", "actor_ref": "usr_security_owner", "authorities": ["approve_security"] },
    { "role": "legal_owner", "actor_ref": "usr_legal_owner", "authorities": ["approve_legal"] },
    { "role": "budget_owner", "actor_ref": "usr_budget_owner", "authorities": ["approve_budget"] },
    { "role": "cardholder", "actor_ref": "usr_cardholder", "authorities": ["authenticate_payment"] }
  ],
  "budget": {
    "ceiling_amount": "1000.00",
    "currency": "USD",
    "horizon_days": 365,
    "valid_until": "2026-08-31T23:59:59Z",
    "owner_role": "budget_owner",
    "cost_center_id": "cc_client_delivery"
  },
  "operational_preferences": {
    "admin_capacity": "low",
    "required_integrations": ["google_workspace", "slack", "zoom"],
    "identity_preference": "native",
    "maximum_deployment_days": 2
  },
  "created_at": "2026-08-02T00:15:00Z"
}
